{
  "component": "Switch",
  "source": "src/lib/wa/switch/Switch.svelte",
  "parts": {
    "base switch": {
      "tag": "label",
      "role": null,
      "dataSlot": "base switch"
    },
    "control": {
      "tag": "span",
      "role": null,
      "dataSlot": "control"
    },
    "thumb": {
      "tag": "span",
      "role": null,
      "dataSlot": "thumb"
    },
    "label": {
      "tag": "span",
      "role": null,
      "dataSlot": "label"
    },
    "hint": {
      "tag": "div",
      "role": null,
      "dataSlot": "hint"
    }
  },
  "states": {
    "div": [
      "data-checked",
      "data-disabled",
      "data-required",
      "data-size"
    ],
    "input": [
      "aria-checked",
      "aria-describedby"
    ],
    "hint": [
      "aria-hidden"
    ]
  },
  "props": {
    "checked": {
      "type": "object",
      "default": null
    },
    "defaultChecked": {
      "type": "object",
      "default": null
    },
    "value": {
      "type": "string",
      "default": "on"
    },
    "size": {
      "type": "string",
      "default": "m"
    },
    "label": {
      "type": "string",
      "default": ""
    },
    "hint": {
      "type": "string",
      "default": ""
    },
    "required": {
      "type": "boolean",
      "default": false
    },
    "disabled": {
      "type": "boolean",
      "default": false
    },
    "name": {
      "type": "object",
      "default": null
    },
    "form": {
      "type": "object",
      "default": null
    },
    "title": {
      "type": "string",
      "default": ""
    },
    "customError": {
      "type": "object",
      "default": null
    },
    "children": {
      "type": "object",
      "default": null
    },
    "hintSnippet": {
      "type": "object",
      "default": null
    },
    "onblur": {
      "type": "object",
      "default": null
    },
    "onchange": {
      "type": "object",
      "default": null
    },
    "oninput": {
      "type": "object",
      "default": null
    },
    "onfocus": {
      "type": "object",
      "default": null
    },
    "oninvalid": {
      "type": "object",
      "default": null
    }
  },
  "snippets": [
    "children",
    "hintSnippet"
  ]
}